Category,Keyword,Tweet_Website,Author_Name,Author_Web_Page_URL,UTC_Time,Tweet_Content,Tweet_Image_URL,Tweet_AD,Tweet_Number_of_Reviews,Tweet_Number_of_Retweets,Tweet_Number_of_Likes,Tweet_Number_of_Looks
Post&amp;Comment,Pro Palestine,https://twitter.com/BBCNewsnight/status/1719131496307400797,BBC NewsnightReload,https://twitter.com/BBCNewsnight,2023-10-30T23:17:43.000Z,"""[It was] inflammatory and dangerous rhetoric.""The Interim Director of Liberty, Akiko Hart,  says the Home Secretary, Suella Braverman, showed a ""failure of leadership"" after branding pro-Palestine marches as 'hate marches'.#Newsnight",,False,550,748,1.9K,546K
Post&amp;Comment,Pro Palestine,https://twitter.com/RT_com/status/1719132070734159975,RTReload,https://twitter.com/RT_com,2023-10-30T23:20:00.000Z,"Pro-Palestine rallies held in İstanbul, London, Berlin, and NYC",,False,32,237,616,23K
Post&amp;Comment,Pro Palestine,https://twitter.com/EBthewarrior/status/1719088654805582263,EbrahimReload,https://twitter.com/EBthewarrior,2023-10-30T20:27:29.000Z,Pro Palestine protesters in Germany getting interrogated and arrested by police,,False,10,56,88,4.5K
Post&amp;Comment,Pro Palestine,https://twitter.com/kwilliam111/status/1719109298603594178,kwilliamReloadSeeking Justice,https://twitter.com/kwilliam111,2023-10-30T21:49:30.000Z,Fury as Met Police officers pull down posters of kidnapped Israeli children in London 'to avoid inflaming tensions' - after force failed to clap down on Islamists chanting 'jihad' at pro-Palestine protests #HamasislSIS #BrokenBritain,https://pbs.twimg.com/media/F9J1g_TWcAAd6xK?format=jpg&name=120x120;https://pbs.twimg.com/media/F9J1g_QXQAAm-Nj?format=jpg&name=120x120;https://pbs.twimg.com/media/F9J1g_RXsAAYlup?format=jpg&name=120x120;https://pbs.twimg.com/media/F9J1g_UW4AEXWVC?format=jpg&name=120x120,False,382,1K,1.4K,202K
Post&amp;Comment,Pro Palestine,https://twitter.com/BTnewsroom/status/1719124208330920354,BreakThrough NewsReload,https://twitter.com/BTnewsroom,,The biggest Pro-Palestine march in U.S. history is happening on November 4th.We want to cover it.Help us cover the equipment costs by donating to our fundraiser here:https://gofund.me/e8da5985,,False,40,920,1.9K,58K
Post&amp;Comment,Pro Palestine,https://twitter.com/AneesaMunir4/status/1719093843658748339,Annie 2022ReloadAshok Swain,https://twitter.com/AneesaMunir4,2023-10-30T20:48:06.000Z,What hate march? Half a million! A sea of empathic individuals gathered in London recently for Pro Palestine Protest  (muslims/non muslims)  lovely to see a sense of unity! No hate there,https://pbs.twimg.com/media/F9tytKMW0AAC_iK?format=jpg&name=360x360;https://pbs.twimg.com/media/F9tyvEUW4AAGC-_?format=jpg&name=360x360;https://pbs.twimg.com/media/F9tyvXvWgAAJhQN?format=jpg&name=360x360;https://pbs.twimg.com/media/F9shF3SXAAAFDXQ?format=jpg&name=240x240,False,3,2,6,1.6K
Post&amp;Comment,Pro Palestine,https://twitter.com/AneesaMunir4/status/1719097433760616894,Annie 2022ReloadOmar Mofeed,https://twitter.com/AneesaMunir4,2023-10-30T21:02:22.000Z,"Hate marches???? Half a million at the recent Pro Palestine Protest  There were non muslims (Jews, Christians, humans with hearts and empathy circuits  )",https://pbs.twimg.com/media/F9tsXneXEAA5PuL?format=jpg&name=360x360;https://pbs.twimg.com/media/F9t2ABAWQAAzTFi?format=jpg&name=360x360;https://pbs.twimg.com/media/F9t2AU5WQAArWU0?format=jpg&name=360x360;https://pbs.twimg.com/amplify_video_thumb/1719062603765288960/img/dD4_TWDxgOLCYNQB?format=jpg&name=240x240,False,2,3,4,774
Post&amp;Comment,Pro Palestine,https://twitter.com/Galverson9767/status/1719110229923889522,Anime ZelenskyyDrew Pavlou 柏乐志 Reload,https://twitter.com/Galverson9767,2023-10-30T21:53:12.000Z,Pro Palestine people doing animal abuse,,False,1,4,17,950
Post&amp;Comment,Pro Palestine,https://twitter.com/MailOnline/status/1719077148101874011,Daily Mail Online,https://twitter.com/MailOnline,2023-10-30T19:41:45.000Z,Fury as Met Police officers pull down posters of kidnapped Israeli children in London 'to avoid inflaming tensions' - after force failed to clamp down on Islamists chanting 'jihad' at pro-Palestine protests https://trib.al/9mb13TQ,https://pbs.twimg.com/media/F9tjjl4XoAARyiS?format=jpg&name=small,False,230,589,992,474K
Post&amp;Comment,Pro Palestine,https://twitter.com/TheRealElwynD/status/1719121295814623286,Elwyn Davies,https://twitter.com/TheRealElwynD,2023-10-30T22:37:11.000Z,The Secretary of State for Hate labels a pro-Palestine and pro-peace rally as a “Hate March”. She’s a vile and nasty bigot and the sooner she’s booted out of office the better #Newsnight,https://pbs.twimg.com/media/F9uLtNIWEAA0Hnh?format=jpg&name=small,False,,56,151,7.6K
Post&amp;Comment,Pro Palestine,https://twitter.com/IAmPoliticsGirl/status/1719111884476231829,PoliticsGirlMandana Dayani,https://twitter.com/IAmPoliticsGirl,2023-10-30T21:59:47.000Z,"We can’t turn away as we see antisemitism grow at alarming rates. The behavior of people from Russian airports to Cornell University is terrifying. You can be anti-terrorism, anti-Netanyahu, pro-Palestine and still proudly stand up for the rights of Israel & the Jewish people.",,False,43,366,1.4K,89K
Post&amp;Comment,Pro Palestine,https://twitter.com/mhrkswrld/status/1719134879215206458,,https://twitter.com/mhrkswrld,2023-10-30T23:31:09.000Z,"if youre pro khalistan it only makes actual sense if youre pro palestine. we’re 2 groups fighting for liberation amongst entities that have way too much corrupt power, and kill minorities for their satisfaction. i dont get how you can be in support of one and not the other.",,False,1,6,22,2.5K
Post&amp;Comment,Pro Palestine,https://twitter.com/SistaSeparatist/status/1719118740178997431,Sasha S. Graham,https://twitter.com/SistaSeparatist,2023-10-30T22:27:01.000Z,"A lot of these so-called ""pro Palestine"" accounts only give a shit about Palestinian MALES.Anyway, the females of Gaza and Palestine deserve visibility.",,False,4,21,188,4.6K
Post&amp;Comment,Pro Palestine,https://twitter.com/bimboyugari/status/1719110358743306274,facebook mom,https://twitter.com/bimboyugari,2023-10-30T21:53:43.000Z,The ONLY reason we haven’t really seen tear gas & rubber bullets used against pro Palestine protestors is bc SO many of them are white & that is what is sending the govt into a spiral. like they fully thought it was gonna be BLM 2.0 & they could attack protestors w impunity but…,,False,1,11,75,2.6K
Post&amp;Comment,Pro Palestine,https://twitter.com/AXELKAISER/status/1719125303237177469,AXEL KAISER,https://twitter.com/AXELKAISER,2023-10-30T22:53:06.000Z,LGTB pro Palestine : looking forward to seeing you demonstrating over there,https://pbs.twimg.com/media/F9uPWeeWIAAwLJW?format=jpg&name=small,False,15,78,244,20K
Post&amp;Comment,Pro Palestine,https://twitter.com/feeuhkra/status/1719105884884807850,~ Sami Mokbel,https://twitter.com/feeuhkra,2023-10-30T21:35:57.000Z,Manor Solomon spread lies on his insta story - nothingZinchenko shared a pro Israel post on insta - nothing Choudhury posts a pro Palestine tweet - he's getting a banNice one lads,,False,,5,35,2.3K
Post&amp;Comment,Pro Palestine,https://twitter.com/CharlotteERosen/status/1719139361235538184,Charlotte E. RosenAdam JohnsonReload,https://twitter.com/CharlotteERosen,2023-10-30T23:48:58.000Z,Biden's crew gleefully comparing antizionist and pro-Palestine protestors to Nazis at Charlottesville,,False,2,60,218,12K
Post&amp;Comment,Pro Palestine,https://twitter.com/outlivethemnyc/status/1719107213313069183,Outlive Them NYC,https://twitter.com/outlivethemnyc,2023-10-30T21:41:13.000Z,Neo-nazis are attempting to use pro-Palestine rallies as a way to spread their anti-Semitic conspiracy theories. Read up!,https://pbs.twimg.com/card_img/1721644087902601217/fCPBM57Y?format=jpg&name=small,False,11,438,702,43K
Post&amp;Comment,Pro Palestine,https://twitter.com/Timid_Timothy/status/1719139373487165929,Timothy after school,https://twitter.com/Timid_Timothy,2023-10-30T23:49:01.000Z,I heard Ben & Jerry's are actively pro Palestine,,False,,,17,1K
Post&amp;Comment,Pro Palestine,https://twitter.com/Will_Bunch/status/1719116249618104813,Will BunchJake Sherman,https://twitter.com/Will_Bunch,2023-10-30T22:17:08.000Z,"For Israel supporters, what's worse? A few kids doing pro-Palestine chants on the college green, or these Republicans sabotaging U.S. aid with a blackmail demand on behalf of billionaire donors?I'm looking forward to the Bari Weiss articles calling Mike Johnson an antisemite",,False,32,126,392,27K
Post&amp;Comment,Pro Palestine,https://twitter.com/hugs4crowley/status/1719113457360908681,Remmie𓆓 |DTIYS pinned!!|michael sheen ,https://twitter.com/hugs4crowley,2023-10-30T22:06:02.000Z,"I swear i don’t know if that’s what you really meant or you just didn’t word it correctly. sir, are you neutral or pro palestine ?",,False,6,,20,1.6K
Post&amp;Comment,Pro Palestine,https://twitter.com/seasnofthew1tch/status/1719138141016056307,irix || free PS,https://twitter.com/seasnofthew1tch,2023-10-30T23:44:07.000Z,"zionists talking points are actually so fucking stupid. if being anti-zionist/pro palestine is anti semetic, then being a zionist/anti palestine is islamophobic. don't like it when your own rhetoric is being used against you?#CeasefireNOW #FreePalestine",,False,,9,21,583
Post&amp;Comment,Pro Palestine,https://twitter.com/CoralieAnn/status/1719131628784553993,Coralie,https://twitter.com/CoralieAnn,2023-10-30T23:18:14.000Z,How was your Saturday with your pro Palestine pals?!,,False,4,5,89,1.1K
Post&amp;Comment,Pro Palestine,https://twitter.com/lopaak/status/1719100603224186965,sol on twt (on break),https://twitter.com/lopaak,2023-10-30T21:14:57.000Z,"(note that im pro palestine and ant*z1on*st but i just wanna clarify this point)palestine didnt legalize gay marriage 1951, they decriminalized same sex private relationships, which israel recriminalize when colonizing west bankit was still a big step towards equality that-",,False,7,41,225,7.2K
Post&amp;Comment,Pro Palestine,https://twitter.com/Cernovich/status/1719109689127125082,Cernovich,https://twitter.com/Cernovich,2023-10-30T21:51:04.000Z,"It's perfectly acceptable, as a right wing position, to not be pro-Israel. You can be neutral. It's perfectly principled to refuse to choose a side.You cannot be pro-Palestine, and anyone telling you otherwise is a foreign-funded op or MKULTRA experiment.",https://pbs.twimg.com/media/F9uA0sNbkAAfWcX?format=jpg&name=small;https://pbs.twimg.com/media/F9uA1LdbcAAeV_Q?format=png&name=360x360,False,102,118,799,94K
Post&amp;Comment,Pro Palestine,https://twitter.com/Swiftsbeatles/status/1719137796076482620,LeoReloadإيـمان | ‎﮼بكـــماء,https://twitter.com/Swiftsbeatles,2023-10-30T23:42:45.000Z,To every Israel and IDF supporter this is a message not from pro-Palestine or a Palestinian but from ex IDF soldier,,False,1,44,70,6.1K
Post&amp;Comment,Pro Palestine,https://twitter.com/sandieshoes/status/1719086183379070997,sandieshoes ,https://twitter.com/sandieshoes,2023-10-30T20:17:39.000Z,GBNewsLabour suspends MP Andy MacDonald after his speech at Pro Palestine rally.,,False,10,30,126,2.2K
Post&amp;Comment,Pro Palestine,https://twitter.com/DNArigged/status/1719125687913570766,Rainbow Carin',https://twitter.com/DNArigged,2023-10-30T22:54:38.000Z,#Ottawa pro-#Palestine #March yesterday.#FreePalestineMassive pro-Palestine rally in Ottawa calls on Canadian government to push for ceasefire https://beta.ctvnews.ca/local/ottawa/2023/10/29/1_6622317.amp.html…,https://pbs.twimg.com/media/F9uPsuVXIAAD5nl?format=jpg&name=360x360;https://pbs.twimg.com/media/F9uPsuVWgAArwzC?format=jpg&name=small,False,10,3,19,1.2K
Post&amp;Comment,Pro Palestine,https://twitter.com/rosecolorgirls/status/1719088758174203923,mads ;,https://twitter.com/rosecolorgirls,2023-10-30T20:27:53.000Z,since people are twisting it up and if you need to hear it again ; pro palestine ≠ antisemitism.,,False,,2,10,515
Post&amp;Comment,Pro Palestine,https://twitter.com/TristinHopper/status/1719076481354314217,Tristin Hopper,https://twitter.com/TristinHopper,2023-10-30T19:39:06.000Z,"If you're referring to a protest that just wants to ""stop the violence"" in Gaza, you're referring to something that doesn't exist. By my read, there hasn't been a single ""pro-Palestine"" rally in this country that didn't carry a strong undercurrent of destroying Israel.",,False,22,72,365,18K
Post&amp;Comment,Pro Palestine,https://twitter.com/urfavemermaid/status/1719081684123951191,Bony,https://twitter.com/urfavemermaid,2023-10-30T19:59:47.000Z,"Shout out to Maria guardiola, guardiola’s daughter pro Palestine stand from day 1 till this moment so brave, solid and strongLOVE HER",https://pbs.twimg.com/media/F9tno5yXgAAy4WC?format=jpg&name=360x360;https://pbs.twimg.com/media/F9tnoqsWYAAP1qb?format=jpg&name=small,False,,8,30,2.8K
Post&amp;Comment,Pro Palestine,https://twitter.com/averyofasgard/status/1719126445732110504,avery!!! ✧˚ · .,https://twitter.com/averyofasgard,2023-10-30T22:57:39.000Z,"absolutely sick to my stomach. if you’re not wholeheartedly, unequivocally pro-palestine pls block me.",,False,1,23,75,1.6K
Post&amp;Comment,Pro Palestine,https://twitter.com/n_th_n_/status/1719104203694481734,n th n - #FreeThemAllPhilip Melanchthon Wegmann,https://twitter.com/n_th_n_,2023-10-30T21:29:16.000Z,The Biden administration position is to equate pro-Palestine protests with neo-Nazis.,,False,3,137,318,20K
Post&amp;Comment,Pro Palestine,https://twitter.com/CoryBMorgan/status/1719073147419607167,Cory MorganDon Sharpe Reload,https://twitter.com/CoryBMorgan,2023-10-30T19:25:51.000Z,"How deep are people burying their heads in the sand?How many of these protests do they need to see?It's not ""pro-Palestine""It's pure, unfiltered hatred of Jews and it's time to stamp this shit out.It doesn't belong here.Or anywhere for that matter",,False,58,226,753,32K
Post&amp;Comment,Pro Palestine,https://twitter.com/RevBluesSusie/status/1719089577334333442,Revolution Blues   #StrongerTogether,https://twitter.com/RevBluesSusie,2023-10-30T20:31:09.000Z,"I’ve had it with Zionists screeching that our pro-Palestine marches are antisemitic.This is not about you you motherfuckers, this is about the besieged Palestinians.#PalestiniansDontCount",,False,2,27,77,640
Post&amp;Comment,Pro Palestine,https://twitter.com/TomiLahren/status/1719129217126817976,Tomi LahrenOutKick,https://twitter.com/TomiLahren,2023-10-30T23:08:39.000Z,There is no “pro-Palestine” side to this. Palestine is controlled by Hamas. If you’re screeching for a ceasefire you’re coddling terrorists.,,False,91,316,1.3K,40K
Post&amp;Comment,Pro Palestine,https://twitter.com/Inhumansoflate1/status/1719132871938671098,fighting capitalism since 1492,https://twitter.com/Inhumansoflate1,2023-10-30T23:23:11.000Z,Andy ngo fascist and proud boy associate is doxing people who go to pro Palestine protests on his X account . Which is against X tos,,False,,6,21,914
Post&amp;Comment,Pro Palestine,https://twitter.com/joenickys/status/1719130168395260346,tash | ceo of goldenheart,https://twitter.com/joenickys,2023-10-30T23:12:26.000Z,one of the most frustrating parts of people taking neutral stances is that when you know even a little of what’s going on how is anything but a pro Palestine stance not the only obvious choice?,,False,2,4,23,722
Post&amp;Comment,Pro Palestine,https://twitter.com/kitchup_/status/1719097244782043486,kit,https://twitter.com/kitchup_,2023-10-30T21:01:37.000Z,do we know anything about costa coffee being pro israel or pro palestine? genuine question cuz obviously people are gonna be looking for starbucks replacements and theres a store a couple streets down from me i go to after school sometimes so would that be alright #CeasefireNOW,,False,,2,2,544
Post&amp;Comment,Pro Palestine,https://twitter.com/Anaff26704649/status/1719081907302846945,Xer,https://twitter.com/Anaff26704649,2023-10-30T20:00:40.000Z,Soros is funding all the pro Palestine organizations so those people are misinformed...,,False,,2,3,413
Post&amp;Comment,Pro Palestine,https://twitter.com/Gundamunda33/status/1719101348006789591,Gundamunda,https://twitter.com/Gundamunda33,2023-10-30T21:17:55.000Z,"People are getting rounded up and arrested for pro Palestine posts on Facebook for ""hurting IDF morale""",,False,1,,25,233
Post&amp;Comment,Pro Palestine,https://twitter.com/rosecolorgirls/status/1719087572809330717,mads ;Marisa misses Big Time Rush,https://twitter.com/rosecolorgirls,2023-10-30T20:23:11.000Z,remember. you can be pro palestine and be against antisemitism .. it's not hard. let people be upset. they are allowed to have feelings.,,False,,1,5,557
Post&amp;Comment,Pro Palestine,https://twitter.com/PetreRaleigh/status/1719129880678326460,Peter Raleigh,https://twitter.com/PetreRaleigh,2023-10-30T23:11:18.000Z,A lot of people disgracing themselves in this particular moment but the people in positions of power and influence attempting to destroy random pro-Palestine college students are especially contemptible,,False,2,14,106,3.7K
Post&amp;Comment,Pro Palestine,https://twitter.com/suckapunk/status/1719100506675581051,jordan☭Philip Melanchthon Wegmann,https://twitter.com/suckapunk,2023-10-30T21:14:34.000Z,"One thing that’s caused me a lot of cognitive dissonance is the way it doesn’t matter how many pro Palestine demonstrations are lead by Jewish orgs, the pro israel (genocide) side absolutely refuses to modify their talking points",,False,1,3,22,634
Post&amp;Comment,Pro Palestine,https://twitter.com/RebelNewsOnline/status/1719107050079150454,Rebel News,https://twitter.com/RebelNewsOnline,2023-10-30T21:40:34.000Z,BREAKING: Masked 'pro-Palestine' protestors have overrun the federal offices of at least 17 MPs across Canada as opposition to the Israel ground incursion of Gaza heats up.READ MORE: https://rebelne.ws/46T4ONQ,https://pbs.twimg.com/media/F9t-oAdWYAACJv5?format=jpg&name=small,False,77,71,143,31K
Post&amp;Comment,Pro Palestine,https://twitter.com/beeronwyn/status/1719127661170004232,bronwyn ,https://twitter.com/beeronwyn,2023-10-30T23:02:28.000Z,"my twitter feed/tiktok feed before work: free palestine, save palestine, pro palestinemy feeds after work: pro israelwhy? i haven’t been on my phone my ENTIRE shift so why has the algorithm changed?! i do NOT support israel. FREE PALESTINE",,False,,2,2,125
Post&amp;Comment,Pro Palestine,https://twitter.com/SocialistMMA/status/1719136519766880380,Revolutionary Blackout NetworkRevolutionary Blackout Network,https://twitter.com/SocialistMMA,2023-10-30T23:37:40.000Z,"Jimmy Dore & Peter Daou Fight Over Cornel West | Ritchie Torres vs Pro-Palestine DSA  | Abby Martin Calls Out Bernie Sanders | Worldwide ""Free Palestine"" Protests | Jamaal Bowman Pleads Guilty Over Fire Alarm | Abby Martin's Receipts on Genocidal Israel",,False,2,25,47,2.9K
Post&amp;Comment,Pro Palestine,https://twitter.com/sevenflings/status/1719088896212976014,faye ִ ࣪𖤐,https://twitter.com/sevenflings,2023-10-30T20:28:26.000Z,"if you are israeli, you can still be pro palestine .if u are jewish, you can still be pro palestine.it's really that simple",https://pbs.twimg.com/media/F9tuPFbWAAATaIs?format=jpg&name=small,False,,,11,189
Post&amp;Comment,Pro Palestine,https://twitter.com/Linez_OG/status/1719131791062184291,Caroline,https://twitter.com/Linez_OG,2023-10-30T23:18:53.000Z,All these pro Palestine protesters make Jan 6th look like nothing so why aren’t they being charged?,,False,3,,35,2.6K
Post&amp;Comment,Pro Palestine,https://twitter.com/GBNEWS/status/1719137585346326548,GB NewsReload,https://twitter.com/GBNEWS,2023-10-30T23:41:55.000Z,"'Pro-Palestine marches are 'hate marches', says Suella Braverman' | Telegraph @TheSimonEvans @LewisSchaffer @joshxhowie",,False,32,18,106,12K
Post&amp;Comment,Pro Palestine,https://twitter.com/MustangMan_TX/status/1719090863802851510,Texas,https://twitter.com/MustangMan_TX,2023-10-30T20:36:15.000Z,It looks like college campuses are about to have a campus Civil War between pro Israel and pro Palestine students! This world is lost!,,False,2,3,32,564
Post&amp;Comment,Pro Palestine,https://twitter.com/LKreipe/status/1719130870244618688,LMKGill ,https://twitter.com/LKreipe,2023-10-30T23:15:14.000Z,"Just came back from Copenhagen where there were pro Palestine protests on Saturday, smaller as so is population. Didn’t see any police or any aggression.",,False,1,,10,512
Post&amp;Comment,Pro Palestine,https://twitter.com/BeckyABerry/status/1719140030818439359,Becky Berry,https://twitter.com/BeckyABerry,2023-10-30T23:51:38.000Z,not sure there is a difference between pro hamas and pro palestine they both want Jews dead,,False,,1,2,36
Post&amp;Comment,Pro Palestine,https://twitter.com/memorialdevice/status/1719116159088218540,Memorial Device,https://twitter.com/memorialdevice,2023-10-30T22:16:46.000Z,‘Suella Braverman calls pro-Palestine demos ‘hate marches’Hate is all she knows. All she is about.,https://pbs.twimg.com/card_img/1721500121462915074/qi6adnEY?format=jpg&name=small,False,13,25,258,11K
Post&amp;Comment,Pro Palestine,https://twitter.com/MaierViv/status/1719075139638239526,Jojo جوانBintReload,https://twitter.com/MaierViv,2023-10-30T19:33:46.000Z,Meanwhile ordinary decent people attending peaceful pro Palestine march are the ones smeared with creating anti-Semitism?,,False,2,4,11,214
Post&amp;Comment,Pro Palestine,https://twitter.com/TheRealKeean/status/1719079321653182696,Keean Bexte,https://twitter.com/TheRealKeean,2023-10-30T19:50:23.000Z,"BREAKING: Pro-Palestine activists salute Hitler, and several of their kids join in. READ:",https://pbs.twimg.com/card_img/1721616014700339200/IGY07Oie?format=jpg&name=small,False,48,140,255,19K
Post&amp;Comment,Pro Palestine,https://twitter.com/simonateba/status/1719091103071178775,Simon AtebaReloadRNC Research,https://twitter.com/simonateba,2023-10-30T20:37:12.000Z,"Fox News correspondent @pdoocy asks @WhiteHouse whether Pro-Palestine protests on campuses mean American youths are 'still involved' or 'doomed.' White House says it condemns any form of hate in America, including antisemitism. WATCH",,False,85,37,140,24K
Post&amp;Comment,Pro Palestine,https://twitter.com/ElliotElinor/status/1719118448025067908,Elinor Elliot,https://twitter.com/ElliotElinor,2023-10-30T22:25:52.000Z,"It is just unbelievable how extreme, irresponsible, and unfit for office this woman is. Suella Braverman calls pro-Palestine demos ‘hate marches’",https://pbs.twimg.com/card_img/1721500121462915074/qi6adnEY?format=jpg&name=small,False,13,80,252,3.8K
Post&amp;Comment,Pro Palestine,https://twitter.com/sentientnerd/status/1719138453030359476,Clowning and suffering   ,https://twitter.com/sentientnerd,2023-10-30T23:45:21.000Z,"Ugh I am in my 30s and my 60yro mother is extremely pro Palestine too, let's not make this an age thing, please",,False,1,,38,1.4K
Post&amp;Comment,Pro Palestine,https://twitter.com/Tazman_London/status/1719073263156859265,Taz  ,https://twitter.com/Tazman_London,2023-10-30T19:26:19.000Z,Media doubling down on any pro Palestinian stance - pushing out narratives that paint pro Palestine cause as “antisemitic” and proactively pushing reports on MPs who resign or are fired for adopting any positions against Israel. We are living in dangerous times folks.,,False,,7,6,153
Post&amp;Comment,Pro Palestine,https://twitter.com/remend2025/status/1719090903653204240,Yo,https://twitter.com/remend2025,2023-10-30T20:36:25.000Z,Also these cowards have doxxed and harassed pro Palestine voices so these dudes hypocrisy is not working on anybody,,False,,,10,81
Post&amp;Comment,Pro Palestine,https://twitter.com/rins2pworth/status/1719114009721311436,Rin  RIP Labour  #GTTO,https://twitter.com/rins2pworth,2023-10-30T22:08:14.000Z,"ROTFWL come on Beth get real Starmer is pro Zionism and anti Palestine.. if you want to do anything leave labour with other MPs (my a few of those 172 that had the bare faced front to walk out on Corbyn) MPs make me sick with their fake ""care"" ..",,False,1,4,26,916
Post&amp;Comment,Pro Palestine,https://twitter.com/realmonsanto/status/1719081726729678927,Efrain Flores Monsanto Reload,https://twitter.com/realmonsanto,2023-10-30T19:59:57.000Z,BREAKING: Pro-Palestine protesters have shutdown DPM Chrystia Freeland's offices to call for a ceasefire while Hamas holds over 100 Israeli hostage.Police are inside. Some block my view with posters. A Jewish community centre is right across here.http://TheTruthAboutTheWar.com,,False,39,76,115,16K
Post&amp;Comment,Pro Palestine,https://twitter.com/bobmackin/status/1719092931364319666,Bob Mackin,https://twitter.com/bobmackin,2023-10-30T20:44:28.000Z,"Organizers of the pro-Palestine sit-in at MP offices are professional protest organizers with @350Canada and @DavidSuzukiFDN, plus Harsha Walia, who defended the Oct. 7 Hamas terrorist attack on Israelis in a rant at an Oct. 9 Vancouver protest. #cdnpoli",https://pbs.twimg.com/media/F9tvBixaIAAU4Ex?format=jpg&name=small;https://pbs.twimg.com/media/F9tvBjKagAAPMoL?format=jpg&name=360x360;https://pbs.twimg.com/media/F9tvHfRaMAAVO5J?format=jpg&name=360x360;https://pbs.twimg.com/media/F9twitGbIAAKgrt?format=jpg&name=small,False,12,45,60,65K
Post&amp;Comment,Pro Palestine,https://twitter.com/bobmackin/status/1719087819015196891,Bob Mackin,https://twitter.com/bobmackin,2023-10-30T20:24:09.000Z,Today’s co-ordinated pro-Palestine sit-ins at MP offices involve professional protest organizers from @350Canada (Atiya Jaffar and Emma Jackson) and @DavidSuzukiFDN + institute (Katie Perfitt and Anjali Appadurai). Also includes Hamas terrorist sympathizer Harsha Walia. #cdnpoli,https://pbs.twimg.com/media/F9tsW7MbIAAL0J-?format=png&name=360x360;https://pbs.twimg.com/media/F9tsa2faMAAvvXl?format=jpg&name=small;https://pbs.twimg.com/media/F9tsa23bIAATMv-?format=png&name=small;https://pbs.twimg.com/media/F9tssKYaAAAeEPf?format=png&name=360x360,False,9,50,59,6.3K
